{
  "code": "crk",
  "name": "Plains Cree",
  "linguisticChallenges": {
    "polysynthesis": "Cree is highly polysynthetic. A single verb can incorporate subject/object pronouns, instrumentals, locations, and actions. Translate phrases conceptually rather than word-for-word.",
    "animacy": "Verb conjugation changes completely based on whether the subject/object nouns are animate or inanimate. Ensure grammatical agreement.",
    "neologisms": "Avoid literal translations of modern software concepts. Maintain English loanwords for modern UI elements when no community-accepted Cree term exists."
  },
  "encyclopedic": {
    "dialects": {
      "split": true,
      "classification": "Plains Cree (y-dialect)",
      "variants": [
        "crk",
        "cwd",
        "csw"
      ]
    },
    "demographics": {
      "speakers": "Approx. 20,000 active speakers",
      "regions": [
        "Saskatchewan",
        "Alberta",
        "Manitoba"
      ]
    },
    "history": "Plains Cree is the most widely spoken Algonquian language in Canada. Historically, it functioned as a regional trade lingua franca across the Canadian plains.",
    "resources": {
      "wikipedia": "https://en.wikipedia.org/wiki/Plains_Cree",
      "foundations": [
        {
          "name": "University of Alberta ALTLab",
          "url": "https://altlab.artsrn.ualberta.ca/"
        }
      ],
      "dictionaries": [
        {
          "name": "itwêwina (Plains Cree Dictionary)",
          "url": "https://itwewina.altlab.app/"
        }
      ]
    }
  }
}
