{
  "code": "es",
  "name": "Spanish",
  "linguisticChallenges": {
    "regionalVocabularyDivergence": "Spanish has the largest regional vocabulary split of any European language. 'Computer' alone has four variants: computadora (LatAm), ordenador (Spain), computador (Colombia/Chile). MT must target a specific region or use neutral vocabulary. A single Peninsular term in a LatAm product immediately signals 'wrong Spanish'.",
    "voseo": "Several Latin American countries (Argentina, Uruguay, parts of Central America) use 'vos' instead of 'tú' for informal address, with different verb conjugations (vos tenés vs tú tienes). MT models default to tú unless explicitly prompted. Using tú in Argentina reads as foreign.",
    "invertedPunctuation": "Spanish requires inverted question marks (¿) and exclamation marks (¡) at the beginning of interrogative/exclamatory clauses. MT systems almost always produce these correctly, but they occasionally omit them or misplace them in complex sentences. Their absence is immediately noticeable to native readers.",
    "subjunctiveMood": "Spanish has a productive subjunctive mood used in wishes, doubts, hypotheticals, and subordinate clauses. English doesn't map cleanly onto these uses. MT frequently produces indicative where subjunctive is required (e.g., 'Esperamos que *tiene' instead of 'Esperamos que tenga'), which sounds grammatically wrong.",
    "genderedInclusivity": "The -e ending (e.g., 'todes' instead of 'todos') and the -x ending ('todxs') for gender-inclusive Spanish are contested. The Real Academia Española opposes both. Usage varies strongly by region and audience. MT models almost never produce these forms without explicit instruction.",
    "diminutivesAndAugmentatives": "Spanish uses productive diminutive (-ito/-ita, -illo/-illa) and augmentative (-ón/-ona, -azo/-aza) suffixes that convey affection, smallness, emphasis, or disdain. These are common in casual speech but should generally be avoided in professional UI text. MT sometimes produces them inappropriately."
  },
  "encyclopedic": {
    "family": "Romance (Indo-European)",
    "demographics": {
      "speakers": "~580 million (including L2)",
      "regions": [
        "Spain",
        "Mexico",
        "Central America",
        "South America",
        "United States",
        "Caribbean",
        "Equatorial Guinea",
        "Philippines"
      ]
    },
    "dialects": {
      "split": true,
      "classification": "Major dialect groups: Peninsular (Castilian), Mexican, Central American, Caribbean, Andean, Rioplatense. Mutual intelligibility is high but vocabulary and pronunciation differ significantly.",
      "variants": [
        "es-MX",
        "es-AR",
        "es-ES",
        "es-CO",
        "es-CL"
      ]
    },
    "history": "Spanish is the world's fourth most spoken language and the second most spoken by native speakers. It spread to the Americas through colonization starting in 1492. The Real Academia Española (RAE, founded 1713) regulates the language alongside 22 national academies.",
    "resources": {
      "wikipedia": "https://en.wikipedia.org/wiki/Spanish_language",
      "foundations": [
        {
          "name": "Real Academia Española (RAE)",
          "url": "https://www.rae.es/"
        }
      ],
      "dictionaries": [
        {
          "name": "Diccionario de la RAE",
          "url": "https://dle.rae.es/"
        }
      ]
    }
  },
  "resources": {
    "fsts": [
      {
        "name": "spaCy Spanish model (es_core_news_sm)",
        "url": "https://spacy.io/models/es",
        "type": "tokenizer"
      }
    ],
    "corpora": [
      {
        "name": "OPUS (multiple EN-ES parallel corpora)",
        "url": "https://opus.nlpl.eu/results/en&es/corpus-result-table",
        "type": "parallel",
        "pairs": [
          "en-es"
        ]
      },
      {
        "name": "FLORES+ devtest",
        "url": "https://github.com/openlanguagedata/flores",
        "type": "parallel",
        "pairs": [
          "en-es"
        ]
      }
    ],
    "models": [
      {
        "name": "NLLB-200 (spa_Latn)",
        "url": "https://huggingface.co/facebook/nllb-200-distilled-600M",
        "type": "nmt"
      }
    ]
  }
}
